SCHOOL,SCHOOL NAME,ATTD DATE,%ATTD
29Q498,"HEALTH, ARTS, ROBOTICS, AND TECHNOLOGY HIGH SCHOOL",6/07/2024,58.31
30Q258,ENERGY TECH HIGH SCHOOL,6/07/2024,76.93
30Q286,"YOUNG WOMEN S LEADERSHIP SCHOOL, ASTORIA",6/07/2024,81.67
30Q301,ACADEMY FOR CAREERS IN TELEVISION AND FILM,6/07/2024,84.06
30Q417,GOTHAM TECH HIGH SCHOOL,6/07/2024,68.39
30Q445,WILLIAM CULLEN BRYANT HIGH SCHOOL,6/07/2024,63.53
30Q450,LONG ISLAND CITY HIGH SCHOOL,6/07/2024,60.09
30Q501,FRANK SINATRA SCHOOL OF THE ARTS HIGH SCHOOL,6/07/2024,86.19
30Q502,INFORMATION TECHNOLOGY HIGH SCHOOL,6/07/2024,56.19
30Q555,NEWCOMERS HIGH SCHOOL,6/07/2024,58.18
30Q575,ACADEMY OF AMERICAN STUDIES,6/07/2024,58.25
30Q580,BACCALAUREATE SCHOOL FOR GLOBAL EDUCATION,6/07/2024,74.80
31R028,THE EAGLE ACADEMY FOR YOUNG MEN OF STATEN ISLAND,6/07/2024,69.82
31R047,CSI HIGH SCHOOL FOR INTERNATIONAL STUDIES,6/07/2024,68.62
31R064,GAYNOR MCCOWN EXPEDITIONARY LEARNING SCHOOL,6/07/2024,80.30
31R085,THE YOUNG WOMENS LEADERSHIP SCHOOL OF STATEN ISLA,6/07/2024,82.40
31R440,NEW DORP HIGH SCHOOL,6/07/2024,99.39
31R445,PORT RICHMOND HIGH SCHOOL,6/07/2024,61.29
31R450,CURTIS HIGH SCHOOL,6/07/2024,57.96
31R455,TOTTENVILLE HIGH SCHOOL,6/07/2024,63.45
31R460,SUSAN E. WAGNER HIGH SCHOOL,6/07/2024,80.02
31R470,CONCORD HIGH SCHOOL,6/07/2024,32.00
31R600,RALPH R. MCKEE CAREER AND TECHNICAL EDUCATION HIGH,6/07/2024,65.80
31R605,STATEN ISLAND TECHNICAL HIGH SCHOOL,6/07/2024,95.97
32K168,THE BROOKLYN SCHOOL FOR MATH AND RESEARCH,6/07/2024,78.08
32K403,ACADEMY FOR EXCELLENCE IN LEADERSHIP,6/07/2024,61.56
32K545,EBC HIGH SCHOOL FOR PUBLIC SERVICE   BUSHWICK,6/07/2024,32.55
32K549,THE BROOKLYN SCHOOL FOR SOCIAL JUSTICE,6/07/2024,55.80
32K552,THE ACADEMY OF URBAN PLANNING AND ENGINEERING,6/07/2024,79.57
32K554,ALL CITY LEADERSHIP SECONDARY SCHOOL,6/07/2024,83.17
32K556,BUSHWICK LEADERS HIGH SCHOOL FOR ACADEMIC EXCELLEN,6/07/2024,39.26
32K564,BUSHWICK COMMUNITY HIGH SCHOOL,6/07/2024,48.71
75K371,P.S. 371   LILLIAN L. RASHKIS,6/07/2024,48.27
75K753,P.S. K753   SCHOOL FOR CAREER DEVELOPMENT,6/07/2024,38.46
75K811,P.S. K811 CONNIE LEKAS SCHOOL,6/07/2024,69.23
75M079,P.S. M079   HORAN SCHOOL,6/07/2024,NS
75M721,P.S. M721   MANHATTAN OCCUPATIONAL TRAINING CENTER,6/07/2024,NS
75M751,MANHATTAN SCHOOL FOR CAREER DEVELOPMENT,6/07/2024,69.76
75Q752,QUEENS TRANSITION CENTER,6/07/2024,100.00
75R721,THE RICHARD H. HUNGERFORD SCHOOL,6/07/2024,NS
75X012,P.S. X012 LEWIS AND CLARK SCHOOL,6/07/2024,NS
75X176,P.S. X176,6/07/2024,60.41
75X721,P.S. X721   STEPHEN MCSWEENEY SCHOOL,6/07/2024,72.72
75X754,J. M. RAPPORT SCHOOL CAREER DEVELOPMENT,6/07/2024,NS
75X811,P.S. X811,6/07/2024,66.66
